<?xml version="1.0" encoding="UTF-8"?>
<!ELEMENT persons (person*)>

<!ELEMENT person (first-name,middle-name,last-name,birthday,email)>

<!ELEMENT first-name (#PCDATA)>

<!ELEMENT middle-name (#PCDATA)>

<!ELEMENT last-name (#PCDATA)>

<!ELEMENT birthday (#PCDATA)>

<!ELEMENT email (#PCDATA)>